{
  "corpus_version": "1.0.0",
  "description": "Ground truth sintetico y ficticio para benchmark de extraccion de relaciones. Universos RPG inventados: eldoria, umbral, nova-frontier. NO contiene corpus privado ni documentos historicos reales.",
  "temporal_status_values": [
    "PAST",
    "PRESENT",
    "FUTURE",
    "ONGOING",
    "ENDED",
    "ATEMPORAL"
  ],
  "expected_decision_values": [
    "ACCEPT",
    "REJECT",
    "REVIEW"
  ],
  "relations": [
    {
      "relation_id": "rel-001",
      "source_id": "src-01",
      "workspace": "eldoria",
      "segment_id": "src-01#s1",
      "subject_id": "ysolde",
      "subject_text": "reina Ysolde",
      "subject_type": "Character",
      "predicate": "ALLIED_WITH",
      "object_id": "clan-roble",
      "object_text": "Clan del Roble",
      "object_type": "Faction",
      "evidence_text": "selló una alianza con el Clan del Roble",
      "evidence_start": 26,
      "evidence_end": 65,
      "negated": false,
      "temporal_status": "PAST",
      "epistemic_status": "ASSERTED",
      "direction": "UNDIRECTED",
      "expected_decision": "ACCEPT",
      "annotator_notes": "Alianza simetrica; alcance pasado ('antes del asedio')."
    },
    {
      "relation_id": "rel-002",
      "source_id": "src-01",
      "workspace": "eldoria",
      "segment_id": "src-01#s3",
      "subject_id": "clan-roble",
      "subject_text": "Clan del Roble",
      "subject_type": "Faction",
      "predicate": "ENEMY_OF",
      "object_id": "horda-grael",
      "object_text": "Horda de Grael",
      "object_type": "Faction",
      "evidence_text": "luchó contra la Horda de Grael",
      "evidence_start": 150,
      "evidence_end": 180,
      "negated": false,
      "temporal_status": "PAST",
      "epistemic_status": "ASSERTED",
      "direction": "UNDIRECTED",
      "expected_decision": "ACCEPT",
      "annotator_notes": "Enemistad simetrica derivada de combate."
    },
    {
      "relation_id": "rel-003",
      "source_id": "src-01",
      "workspace": "eldoria",
      "segment_id": "src-01#s3",
      "subject_id": "clan-roble",
      "subject_text": "Clan del Roble",
      "subject_type": "Faction",
      "predicate": "PARTICIPATED_IN",
      "object_id": "batalla-vado",
      "object_text": "Batalla del Vado",
      "object_type": "Event",
      "evidence_text": "el Clan del Roble luchó contra la Horda de Grael en la Batalla del Vado",
      "evidence_start": 132,
      "evidence_end": 203,
      "negated": false,
      "temporal_status": "PAST",
      "epistemic_status": "ASSERTED",
      "direction": "SUBJECT_TO_OBJECT",
      "expected_decision": "ACCEPT",
      "annotator_notes": "Participacion de faccion en evento."
    },
    {
      "relation_id": "rel-004",
      "source_id": "src-01",
      "workspace": "eldoria",
      "segment_id": "src-01#s4",
      "subject_id": "ysolde",
      "subject_text": "reina Ysolde",
      "subject_type": "Character",
      "predicate": "TRUSTS",
      "object_id": "horda-grael",
      "object_text": "Horda de Grael",
      "object_type": "Faction",
      "evidence_text": "reina Ysolde nunca confió en la Horda de Grael",
      "evidence_start": 208,
      "evidence_end": 254,
      "negated": true,
      "temporal_status": "PAST",
      "epistemic_status": "ASSERTED",
      "direction": "SUBJECT_TO_OBJECT",
      "expected_decision": "REJECT",
      "annotator_notes": "NEGACION: 'nunca confió'. La relacion de confianza NO se afirma; se marca REJECT por negacion."
    },
    {
      "relation_id": "rel-005",
      "source_id": "src-02",
      "workspace": "eldoria",
      "segment_id": "src-02#s2",
      "subject_id": "draven",
      "subject_text": "Draven",
      "subject_type": "Character",
      "predicate": "MEMBER_OF",
      "object_id": "orden-alba",
      "object_text": "Orden del Alba",
      "object_type": "Faction",
      "evidence_text": "miembro de la Orden del Alba",
      "evidence_start": 43,
      "evidence_end": 71,
      "negated": false,
      "temporal_status": "PRESENT",
      "epistemic_status": "ASSERTED",
      "direction": "SUBJECT_TO_OBJECT",
      "expected_decision": "ACCEPT",
      "annotator_notes": "Pertenencia explicita."
    },
    {
      "relation_id": "rel-006",
      "source_id": "src-02",
      "workspace": "eldoria",
      "segment_id": "src-02#s3",
      "subject_id": "draven",
      "subject_text": "Draven",
      "subject_type": "Character",
      "predicate": "LIVES_IN",
      "object_id": "torre-sable",
      "object_text": "Torre de Sable",
      "object_type": "Location",
      "evidence_text": "vive en la Torre de Sable",
      "evidence_start": 85,
      "evidence_end": 110,
      "negated": false,
      "temporal_status": "PRESENT",
      "epistemic_status": "ASSERTED",
      "direction": "SUBJECT_TO_OBJECT",
      "expected_decision": "ACCEPT",
      "annotator_notes": "Sujeto omitido (elipsis en ficha); sujeto = Draven por contexto de la ficha."
    },
    {
      "relation_id": "rel-007",
      "source_id": "src-02",
      "workspace": "eldoria",
      "segment_id": "src-02#s4",
      "subject_id": "draven",
      "subject_text": "Draven",
      "subject_type": "Character",
      "predicate": "OWNS",
      "object_id": "filo-luna",
      "object_text": "Filo de Luna",
      "object_type": "Object",
      "evidence_text": "porta la espada Filo de Luna",
      "evidence_start": 124,
      "evidence_end": 152,
      "negated": false,
      "temporal_status": "PRESENT",
      "epistemic_status": "ASSERTED",
      "direction": "SUBJECT_TO_OBJECT",
      "expected_decision": "ACCEPT",
      "annotator_notes": "Posesion de objeto; sujeto omitido = Draven."
    },
    {
      "relation_id": "rel-008",
      "source_id": "src-02",
      "workspace": "eldoria",
      "segment_id": "src-02#s5",
      "subject_id": "aldric",
      "subject_text": "Aldric",
      "subject_type": "Character",
      "predicate": "PARENT_OF",
      "object_id": "draven",
      "object_text": "Draven",
      "object_type": "Character",
      "evidence_text": "hijo de Aldric",
      "evidence_start": 163,
      "evidence_end": 177,
      "negated": false,
      "temporal_status": "PRESENT",
      "epistemic_status": "ASSERTED",
      "direction": "OBJECT_TO_SUBJECT",
      "expected_decision": "ACCEPT",
      "annotator_notes": "Direccional: 'Draven hijo de Aldric' => Aldric PARENT_OF Draven (object_to_subject)."
    },
    {
      "relation_id": "rel-009",
      "source_id": "src-02",
      "workspace": "eldoria",
      "segment_id": "src-02#s5",
      "subject_id": "draven",
      "subject_text": "Draven",
      "subject_type": "Character",
      "predicate": "PARENT_OF",
      "object_id": "nima",
      "object_text": "Nima",
      "object_type": "Character",
      "evidence_text": "padre de Nima",
      "evidence_start": 179,
      "evidence_end": 192,
      "negated": false,
      "temporal_status": "PRESENT",
      "epistemic_status": "ASSERTED",
      "direction": "SUBJECT_TO_OBJECT",
      "expected_decision": "ACCEPT",
      "annotator_notes": "Direccional: Draven PARENT_OF Nima."
    },
    {
      "relation_id": "rel-010",
      "source_id": "src-02",
      "workspace": "eldoria",
      "segment_id": "src-02#s1",
      "subject_id": "draven",
      "subject_text": "el Cuervo",
      "subject_type": "Character",
      "predicate": "ALIAS_OF",
      "object_id": "draven",
      "object_text": "Draven",
      "object_type": "Character",
      "evidence_text": "Draven, apodado el Cuervo",
      "evidence_start": 7,
      "evidence_end": 32,
      "negated": false,
      "temporal_status": "PRESENT",
      "epistemic_status": "ASSERTED",
      "direction": "UNDIRECTED",
      "expected_decision": "REVIEW",
      "annotator_notes": "ALIAS: 'el Cuervo' == Draven. Relacion reflexiva de identidad; se marca REVIEW porque el contrato prohibe subject==object salvo reflexivos permitidos (aqui alias documental, no relacion de grafo)."
    },
    {
      "relation_id": "rel-011",
      "source_id": "src-03",
      "workspace": "eldoria",
      "segment_id": "src-03#s1",
      "subject_id": "aldric",
      "subject_text": "Aldric",
      "subject_type": "Character",
      "predicate": "FOUNDED",
      "object_id": "reino-valmyr",
      "object_text": "Reino de Valmyr",
      "object_type": "Faction",
      "evidence_text": "Aldric funda el Reino de Valmyr",
      "evidence_start": 9,
      "evidence_end": 40,
      "negated": false,
      "temporal_status": "PAST",
      "epistemic_status": "ASSERTED",
      "direction": "SUBJECT_TO_OBJECT",
      "expected_decision": "ACCEPT",
      "annotator_notes": "Fundacion fechada (812)."
    },
    {
      "relation_id": "rel-012",
      "source_id": "src-03",
      "workspace": "eldoria",
      "segment_id": "src-03#s2",
      "subject_id": "ysolde",
      "subject_text": "Ysolde",
      "subject_type": "Character",
      "predicate": "SUCCEEDED",
      "object_id": "aldric",
      "object_text": "Aldric",
      "object_type": "Character",
      "evidence_text": "Ysolde sucede a Aldric en el trono",
      "evidence_start": 74,
      "evidence_end": 108,
      "negated": false,
      "temporal_status": "PAST",
      "epistemic_status": "ASSERTED",
      "direction": "SUBJECT_TO_OBJECT",
      "expected_decision": "ACCEPT",
      "annotator_notes": "Sucesion direccional (Ysolde despues de Aldric)."
    },
    {
      "relation_id": "rel-013",
      "source_id": "src-03",
      "workspace": "eldoria",
      "segment_id": "src-03#s3",
      "subject_id": "sequia",
      "subject_text": "la sequía",
      "subject_type": "Event",
      "predicate": "CAUSED",
      "object_id": "gran-hambruna",
      "object_text": "Gran Hambruna",
      "object_type": "Event",
      "evidence_text": "la sequía provocó la Gran Hambruna",
      "evidence_start": 119,
      "evidence_end": 153,
      "negated": false,
      "temporal_status": "PAST",
      "epistemic_status": "ASSERTED",